{
  "rover_id": "curiosity",
  "agency": "NASA",
  "status": "ACTIVE",
  "snapshot_date": "2025-12-15",
  "credit": "\u00a9 NASA/JPL-Caltech \u2014 Curiosity rover traverse, simplified hand-vendored polyline approximating the rover's path through Gale Crater from Bradbury Landing (Aug 2012) toward the upper slopes of Mt. Sharp. V1 stub for visual continuity; refresh from NASA MSL Analyst's Notebook for high-fidelity coordinates.",
  "points": [
    [
      -4.5895,
      137.4417
    ],
    [
      -4.59241,
      137.43159
    ],
    [
      -4.60036,
      137.43157
    ],
    [
      -4.60005,
      137.43538
    ],
    [
      -4.60279,
      137.42355
    ],
    [
      -4.6118,
      137.4197
    ],
    [
      -4.61814,
      137.42384
    ],
    [
      -4.62436,
      137.41626
    ],
    [
      -4.62243,
      137.41846
    ],
    [
      -4.63103,
      137.41614
    ],
    [
      -4.62944,
      137.4044
    ],
    [
      -4.63378,
      137.41179
    ],
    [
      -4.64274,
      137.40066
    ],
    [
      -4.64087,
      137.40039
    ],
    [
      -4.65382,
      137.3938
    ],
    [
      -4.65058,
      137.39842
    ],
    [
      -4.65529,
      137.39732
    ],
    [
      -4.6623,
      137.39798
    ],
    [
      -4.66818,
      137.38867
    ],
    [
      -4.66797,
      137.38668
    ],
    [
      -4.67195,
      137.38307
    ],
    [
      -4.67783,
      137.37211
    ],
    [
      -4.6869,
      137.37278
    ],
    [
      -4.69268,
      137.36894
    ],
    [
      -4.69678,
      137.36663
    ],
    [
      -4.69573,
      137.36494
    ],
    [
      -4.70269,
      137.35962
    ],
    [
      -4.70803,
      137.36754
    ],
    [
      -4.71,
      137.358
    ]
  ],
  "stops": [
    {
      "sol": 270,
      "lat": -4.59559,
      "lon": 137.43158,
      "label": "John Klein drill",
      "kind": "drill",
      "id": "sol-270"
    },
    {
      "sol": 1000,
      "lat": -4.61205,
      "lon": 137.41987,
      "label": "Marias Pass",
      "kind": "feature",
      "id": "sol-1000"
    },
    {
      "sol": 1647,
      "lat": -4.63069,
      "lon": 137.41623,
      "label": "Murray Buttes",
      "kind": "panorama",
      "id": "sol-1647"
    },
    {
      "sol": 2300,
      "lat": -4.65382,
      "lon": 137.3938,
      "label": "Vera Rubin Ridge",
      "kind": "feature",
      "id": "sol-2300"
    },
    {
      "sol": 3500,
      "lat": -4.67289,
      "lon": 137.38132,
      "label": "Greenheugh Pediment",
      "kind": "feature",
      "id": "sol-3500"
    }
  ]
}
